identificador;nome_instituicao;estado;lct;situacao;tipo_instituicao;datadisponibilizacao
3307;UNIVERSIDADE FEDERAL DO ESPÍRITO SANTO - CENTRO DE CIÊNCIAS AGRÁRIAS;ESPÍRITO SANTO;SIM;ATIVA;PÚBLICA FEDERAL;2025-10-23
3308;INSTITUTO FEDERAL DE EDUCAÇÃO, CIÊNCIA E TECNOLOGIA DO ESPÍRITO SANTO;ESPÍRITO SANTO;SIM;INATIVA;PÚBLICA FEDERAL;2025-10-23
3309;UNIVERSIDADE FEDERAL DO ESPÍRITO SANTO;ESPÍRITO SANTO;SIM;ATIVA;PÚBLICA FEDERAL;2025-10-23
3310;CENTRO DE CIÊNCIAS EM SAUDE DE ITAJUBÁ S.A/FACULDADE DE MEDICINA DE ITAJUBÁ;MINAS GERAIS;NÃO;ATIVA;PRIVADA COM FINS LUCRATIVOS;2025-10-23
3311;INSTITUTO TEIA PARA DESENVOLVIMENTO SOCIOAMBIENTAL E CULTURAL;MINAS GERAIS;NÃO;INATIVA;PRIVADA SEM FINS LUCRATIVOS;2025-10-23
3312;OURO FINO SAÚDE ANIMAL LTDA;SÃO PAULO;NÃO;INATIVA;PRIVADA COM FINS LUCRATIVOS;2025-10-23
3313;SOCIEDADE DE ENSINO SUPERIOR ESTÁCIO DE SÁ LTDA;MINAS GERAIS;NÃO;ATIVA;PRIVADA COM FINS LUCRATIVOS;2025-10-23
3314;SOCIEDADE DE ENSINO SUPERIOR ESTÁCIO DE SÁ LTDA / FACULDADE ESTÁCIO DE SÁ DE JUIZ DE FORA;RIO DE JANEIRO;NÃO;INATIVA;PRIVADA COM FINS LUCRATIVOS;2025-10-23
3315;A DEFINIR;MINAS GERAIS;NÃO;ATIVA;OUTROS;2025-10-23
3316;RECOMBINE BIOTECNOLOGIA LTDA;MINAS GERAIS;NÃO;ATIVA;PRIVADA COM FINS LUCRATIVOS;2025-10-23
3317;BASF S.A;SÃO PAULO;NÃO;INATIVA;PRIVADA COM FINS LUCRATIVOS;2025-10-23
3318;DOC ENGENHARIA E SERVIÇOS EIRELI;MINAS GERAIS;NÃO;INATIVA;PRIVADA COM FINS LUCRATIVOS;2025-10-23
3320;TACTICUP SOFTWARE E CONSULTORIA PARA O ESPORTE LTDA;MINAS GERAIS;NÃO;ATIVA;PRIVADA COM FINS LUCRATIVOS;2025-10-23
3321;QUAEST PESQUISAS, CONSULTORIA E PROJETOS LTDA.;MINAS GERAIS;NÃO;ATIVA;PRIVADA COM FINS LUCRATIVOS;2025-10-23
3322;SECRETARIA DE ESTADO DE INFRAESTRUTURA E MOBILIDADE;MINAS GERAIS;NÃO;ATIVA;PÚBLICA ESTADUAL;2025-10-23
3323;SITUATED CONSULTORIA E PESQUISA LTDA;MINAS GERAIS;NÃO;ATIVA;PRIVADA COM FINS LUCRATIVOS;2025-10-23
3324;HARGON PESQUISA E DESENVOLVIMENTO EM SAÚDE LTDA;MINAS GERAIS;NÃO;ATIVA;PRIVADA COM FINS LUCRATIVOS;2025-10-23
3325;CENTRO DE DESENVOLVIMENTO, INOVAÇÃO, CIÊNCIA E TECNOLOGIA S/A.;MINAS GERAIS;NÃO;ATIVA;PRIVADA COM FINS LUCRATIVOS;2025-10-23
3326;5ZEROS SERVIÇOS TECNOLÓGICOS LTDA.;MINAS GERAIS;NÃO;ATIVA;PRIVADA COM FINS LUCRATIVOS;2025-10-23
3327;BAWSAW SERVIÇOS TECNOLÓGICOS LTDA.;MINAS GERAIS;NÃO;ATIVA;PRIVADA COM FINS LUCRATIVOS;2025-10-23
3328;BIRTHTECH DISPOSITIVOS PARA A SAUDE LTDA;MINAS GERAIS;NÃO;ATIVA;PRIVADA COM FINS LUCRATIVOS;2025-10-23
3329;ARCELOR MITTAL MATRIZ;MINAS GERAIS;NÃO;ATIVA;PRIVADA COM FINS LUCRATIVOS;2025-10-23
3330;ARCELOR MITTAL FILIAL;MINAS GERAIS;NÃO;INATIVA;PRIVADA COM FINS LUCRATIVOS;2025-10-23
3331;ASSOCIAÇÃO ITAJUBENSE DE INOVAÇÃO E EMPREENDEDORISMO;MINAS GERAIS;NÃO;ATIVA;PRIVADA SEM FINS LUCRATIVOS;2025-10-23
3332;DIRECIONAL ENGENHARIA S/A;MINAS GERAIS;NÃO;ATIVA;PRIVADA COM FINS LUCRATIVOS;2025-10-23
3333;SANTO ANTÔNIO MINI-EÓLICA S/A;MINAS GERAIS;NÃO;ATIVA;PRIVADA COM FINS LUCRATIVOS;2025-10-23
3334;BIOTECH TOWN PARTICIPAÇÕES S/A;MINAS GERAIS;NÃO;ATIVA;PRIVADA COM FINS LUCRATIVOS;2025-10-23
3335;PREFEITURA MUNICIPAL DE UBERABA;MINAS GERAIS;NÃO;ATIVA;PÚBLICA MUNICIPAL;2025-10-23
3336;PROBIOMAS PRODUTOS E SERVIÇOS AMBIENTAIS EIRELI - EPP;MINAS GERAIS;NÃO;ATIVA;PRIVADA COM FINS LUCRATIVOS;2025-10-23
3337;KUNUMI SERVIÇOS EM TECNOLOGIA DA INFORMAÇÃO S.A;MINAS GERAIS;NÃO;ATIVA;PRIVADA COM FINS LUCRATIVOS;2025-10-23
3338;ASSOCIACAO DE MULTIPLA ACAO SOCIAL-MULTIACAO;MINAS GERAIS;NÃO;ATIVA;PRIVADA SEM FINS LUCRATIVOS;2025-10-23
3339;ADWA CANNABIS PESQUISA E DESENVOLVIMENTO LTDA.;MINAS GERAIS;NÃO;ATIVA;PRIVADA COM FINS LUCRATIVOS;2025-10-23
3340;CACATUA CONSULTORIA E ASSESSORIA EM COLETA DE RESÍDUOS ESPECIAIS LTDA;MINAS GERAIS;NÃO;ATIVA;PRIVADA COM FINS LUCRATIVOS;2025-10-23
3341;LEVEBRAS BIOTECNOLOGIA - INOVA SIMPLES (I.S) LTDA;MINAS GERAIS;NÃO;ATIVA;PRIVADA COM FINS LUCRATIVOS;2025-10-23
3342;ELATEC-DESENVOLVIMENTO DE PRODUTOS E INDUSTRIA LTDA;MINAS GERAIS;NÃO;ATIVA;PRIVADA COM FINS LUCRATIVOS;2025-10-23
3343;FUNGAL ID LTDA ME;MINAS GERAIS;NÃO;ATIVA;PRIVADA COM FINS LUCRATIVOS;2025-10-23
3344;ALLCANCI TECNOLOGIA E DESENVOLVIMENTO LTDA;MINAS GERAIS;NÃO;ATIVA;PRIVADA COM FINS LUCRATIVOS;2025-10-23
3345;PREDATIVA CONTROLE BIOLÓGICO LTDA.;MINAS GERAIS;NÃO;ATIVA;PRIVADA COM FINS LUCRATIVOS;2025-10-23
3346;CEPHA BIOTECH PESQUISA E DESENVOLVIMENTO LTDA.;MINAS GERAIS;NÃO;ATIVA;PRIVADA COM FINS LUCRATIVOS;2025-10-23
3347;UNICA PER ME COSMETICOS LTDA;MINAS GERAIS;NÃO;ATIVA;PRIVADA COM FINS LUCRATIVOS;2025-10-23
3348;P A I S - EMPRESA AGROINDUSTRIAL SUSTENTAVEL LTDA;MINAS GERAIS;NÃO;ATIVA;PRIVADA COM FINS LUCRATIVOS;2025-10-23
3349;PYPIV PESQUISA E DESENVOLVIMENTO DE INOVACAO TECNOLOGICA LTDA;MINAS GERAIS;NÃO;ATIVA;PRIVADA COM FINS LUCRATIVOS;2025-10-23
3350;J.R.ENVASADORA  LTDA;MINAS GERAIS;NÃO;ATIVA;PRIVADA COM FINS LUCRATIVOS;2025-10-23
3351;CEMIG SOLUÇÕES INTELIGENTES EM ENERGIA S.A;MINAS GERAIS;NÃO;ATIVA;PRIVADA COM FINS LUCRATIVOS;2025-10-23
3352;GRAFNANO PESQUISA E CONSULTORIA LTDA;MINAS GERAIS;NÃO;ATIVA;PRIVADA COM FINS LUCRATIVOS;2025-10-23
3353;TESTE CAGEC;MINAS GERAIS;NÃO;INATIVA;PRIVADA SEM FINS LUCRATIVOS;2025-10-23
3354;SEARCHONMATH BRASIL LTDA.;MINAS GERAIS;NÃO;ATIVA;PRIVADA COM FINS LUCRATIVOS;2025-10-23
3355;DRONEBALL TECNOLOGIA, COMERCIO E SERVIÇOS DE ENGENHARIA LTDA.;MINAS GERAIS;NÃO;ATIVA;PRIVADA COM FINS LUCRATIVOS;2025-10-23
3356;PREFEITURA MUNICIPAL DE GOVERNADOR VALADARES;MINAS GERAIS;NÃO;ATIVA;PÚBLICA MUNICIPAL;2025-10-23
3357;SIG SOLUÇÕES EM ENERGIA;MINAS GERAIS;NÃO;ATIVA;PRIVADA COM FINS LUCRATIVOS;2025-10-23
3358;FACULDADE SANTA CASA BH - FSCBH;MINAS GERAIS;NÃO;ATIVA;PRIVADA SEM FINS LUCRATIVOS;2025-10-23
3359;EMPRESA BRASILEIRA DE PESQUISA AGROPECUÁRIA;CEARÁ;NÃO;ATIVA;PÚBLICA FEDERAL;2025-10-23
3360;SKEMA ESCOLA DE NEGÓCIOS EIRELI / FACULDADE SKEMA BUSINESS SCHOOL;MINAS GERAIS;NÃO;ATIVA;PRIVADA COM FINS LUCRATIVOS;2025-10-23
3361;LAEL VARELLA EDUCAÇÃO E CULTURA LTDA/FACULDADE DE MINAS BH - FAMINAS-BH;MINAS GERAIS;NÃO;ATIVA;PRIVADA COM FINS LUCRATIVOS;2025-10-23
3362;BROTO BAMBU LTDA;MINAS GERAIS;NÃO;ATIVA;PRIVADA COM FINS LUCRATIVOS;2025-10-23
3363;FABNS FÁBRICA DE NANOSOLUÇÕES E PARTICIPAÇÕES LTDA;MINAS GERAIS;NÃO;ATIVA;PRIVADA COM FINS LUCRATIVOS;2025-10-23
3364;COOPERATIVA DOS APICULTORES E AGRICULTORES FAMILIARES DA REGIÃO DO NORTE DE MMINAS GERAIS;MINAS GERAIS;NÃO;INATIVA;PRIVADA COM FINS LUCRATIVOS;2025-10-23
3365;ELETEC LTDA;MINAS GERAIS;NÃO;ATIVA;PRIVADA COM FINS LUCRATIVOS;2025-10-23
3366;42W CONSULTORIA E SERVIÇOS EM TECNOLOGIA EIRELI;MINAS GERAIS;NÃO;ATIVA;PRIVADA COM FINS LUCRATIVOS;2025-10-23
3367;ENACOM ENERGIA SISTEMAS E SERVICOS DE INFORMACAO S/A;MINAS GERAIS;NÃO;ATIVA;PRIVADA COM FINS LUCRATIVOS;2025-10-23
3368;LIA MARINHA EMPREENDIMENTOS COMERCIAIS EM GERAL LTDA;MINAS GERAIS;NÃO;ATIVA;PRIVADA COM FINS LUCRATIVOS;2025-10-23
3369;GAMA MONTAGENS INDUSTRIAIS LTDA.;MINAS GERAIS;NÃO;ATIVA;PRIVADA COM FINS LUCRATIVOS;2025-10-23
3370;MSM INDUSTRIA E COMÉRCIO LTDA;MINAS GERAIS;NÃO;ATIVA;PRIVADA COM FINS LUCRATIVOS;2025-10-23
3371;NANONIB  NANOTECNOLOGIA E  INOVAÇÃO EM NIOBIO LTDA;MINAS GERAIS;NÃO;ATIVA;PRIVADA COM FINS LUCRATIVOS;2025-10-23
3372;WGV AGROCONSULTORIA LTDA -ME;MINAS GERAIS;NÃO;ATIVA;PRIVADA COM FINS LUCRATIVOS;2025-10-23
3373;ROBOTICTECH SERVIÇO DE TECNOLOGIA LTDA;MINAS GERAIS;NÃO;ATIVA;PRIVADA COM FINS LUCRATIVOS;2025-10-23
3374;THERIONTEC SISTEMAS INOVADORES LTDA;MINAS GERAIS;NÃO;ATIVA;OUTROS;2025-10-23
3375;VERDEAR PAISAGISMO E JARDINAGEM LTDA - ME;MINAS GERAIS;NÃO;ATIVA;PRIVADA COM FINS LUCRATIVOS;2025-10-23
3376;NEXOMED HOSPITALAR LTDA.;MINAS GERAIS;NÃO;ATIVA;PRIVADA COM FINS LUCRATIVOS;2025-10-23
3377;NANOVIEW NANOTECNOLOGIA LTDA;MINAS GERAIS;NÃO;ATIVA;PRIVADA COM FINS LUCRATIVOS;2025-10-23
3378;ARKMEDS SOLUÇOES TECNOLÓGICAS EIRELI;MINAS GERAIS;NÃO;ATIVA;OUTROS;2025-10-23
3379;U.EXPERIENCE CONSULTORIA, PALESTRAS E TREINAMENTOS LTDA;MINAS GERAIS;NÃO;ATIVA;PRIVADA COM FINS LUCRATIVOS;2025-10-23
3380;MOSQUITOS SOLUTIONS;MINAS GERAIS;NÃO;ATIVA;OUTROS;2025-10-23
3381;AUTOMAWAY DESENVOLVIMENTO DE SISTEMAS INTELIGENTES LTDA.;MINAS GERAIS;NÃO;ATIVA;PRIVADA COM FINS LUCRATIVOS;2025-10-23
3382;HENCE ANALITICA SERVICOS E SISTEMAS;MINAS GERAIS;NÃO;ATIVA;PRIVADA COM FINS LUCRATIVOS;2025-10-23
3383;BIOTA INNOVATIONS INDUSTRIA E COMERCIO DE BIOPRODUTOS LTDA;MINAS GERAIS;NÃO;ATIVA;PRIVADA COM FINS LUCRATIVOS;2025-10-23
3384;LATU NEGOCIOS LTDA;MINAS GERAIS;NÃO;ATIVA;PRIVADA COM FINS LUCRATIVOS;2025-10-23
3385;HEDRO SISTEMAS INTELIGENTES;MINAS GERAIS;NÃO;ATIVA;OUTROS;2025-10-23
3386;HEDRO SISTEMAS INTELIGENTES LTDA;MINAS GERAIS;NÃO;INATIVA;PRIVADA COM FINS LUCRATIVOS;2025-10-23
3387;RECICLA CLUB GESTAO DE RESIDUOS LTDA;MINAS GERAIS;NÃO;ATIVA;PRIVADA COM FINS LUCRATIVOS;2025-10-23
3388;IDVIRTUA SOLUÇÕES WEB LTDA.;MINAS GERAIS;NÃO;ATIVA;PRIVADA COM FINS LUCRATIVOS;2025-10-23
3389;IMERSA AUDIOVISUAL MULTIMÍDIA LIMITADA ME;MINAS GERAIS;NÃO;ATIVA;OUTROS;2025-10-23
3390;NEOATO INOVACAO E TECNOLOGIA EIRELI;MINAS GERAIS;NÃO;ATIVA;PRIVADA COM FINS LUCRATIVOS;2025-10-23
3391;LITELEDS TECNOLOGIA LTDA;MINAS GERAIS;NÃO;ATIVA;PRIVADA COM FINS LUCRATIVOS;2025-10-23
3392;ENVIRONMENT INTELIGENCIA DE NEGÓCIOS E TECNOLOGIA LTDA;MINAS GERAIS;NÃO;ATIVA;OUTROS;2025-10-23
3393;DESEMBALA SOLUÇÕES SUSTENTÁVEIS - EIRELI;MINAS GERAIS;NÃO;ATIVA;PRIVADA COM FINS LUCRATIVOS;2025-10-23
3394;THINGABLE SOLUÇÔES DE INFORMÀTICA LTDA;MINAS GERAIS;NÃO;ATIVA;PRIVADA COM FINS LUCRATIVOS;2025-10-23
3395;ORGANIC SOLUÇÕES PESQUISA DESENVOLVIMENTO INOVAÇÃO LTDA;MINAS GERAIS;NÃO;ATIVA;PRIVADA COM FINS LUCRATIVOS;2025-10-23
3396;AGROTEG CONSULTORIA AGRICOLA LTDA;MINAS GERAIS;NÃO;ATIVA;PRIVADA COM FINS LUCRATIVOS;2025-10-23
3397;IN8 SERVICOS ON-LINE LTDA;MINAS GERAIS;NÃO;ATIVA;PRIVADA COM FINS LUCRATIVOS;2025-10-23
3398;EYECONNECT- SOLUÇÔES EM TELEMEDICINA LTDA ME;MINAS GERAIS;NÃO;ATIVA;OUTROS;2025-10-23
3399;BH RECICLA GESTAO DE RESIDUOS LTDA;MINAS GERAIS;NÃO;ATIVA;PRIVADA COM FINS LUCRATIVOS;2025-10-23
3400;TECHENERGY DESENVOLVIMENTO EM TECNOLOGIA E ENGENHARIA LTDA;MINAS GERAIS;NÃO;ATIVA;PRIVADA COM FINS LUCRATIVOS;2025-10-23
3401;ATIVA SOLUÇÕES TECNOLOGICAS INDUSTRIA E COMÉRCIO S/A;MINAS GERAIS;NÃO;ATIVA;PRIVADA COM FINS LUCRATIVOS;2025-10-23
3402;FUSION TECNOLOGIAS LTDA;MINAS GERAIS;NÃO;ATIVA;PRIVADA COM FINS LUCRATIVOS;2025-10-23
3403;MESTTRA TECNOLOGIA LTDA;MINAS GERAIS;NÃO;ATIVA;OUTROS;2025-10-23
3404;FREITAS SANTOS GESTÃO E TECNOLOGIA LTDA;MINAS GERAIS;NÃO;ATIVA;PRIVADA COM FINS LUCRATIVOS;2025-10-23
3405;PECUARIA BRASIL SOFTWARES;MINAS GERAIS;NÃO;ATIVA;PRIVADA COM FINS LUCRATIVOS;2025-10-23
3406;FUNDAÇÃO OSWALDO CRUZ/MATRIZ;RIO DE JANEIRO;SIM;ATIVA;PÚBLICA FEDERAL;2025-10-23
3407;INFTEC INFORMACAO E TECNOLOGIA LTDA;MINAS GERAIS;NÃO;ATIVA;PRIVADA COM FINS LUCRATIVOS;2025-10-23
3408;NEO NEGÓCIOS INOVADORES CORPORATIVOS LTDA;MINAS GERAIS;NÃO;ATIVA;PRIVADA COM FINS LUCRATIVOS;2025-10-23
3409;SANTA CASA DE MISERICORDIA DE BELO HORIZONTE - MATRIZ;MINAS GERAIS;NÃO;ATIVA;PRIVADA SEM FINS LUCRATIVOS;2025-10-23
3410;EMPRESA BRASILEIRA DE PESQUISA AGROPECUARIA;DISTRITO FEDERAL;SIM;ATIVA;PÚBLICA FEDERAL;2025-10-23
3411;FUNDAÇÃO PARA O DESENVOLVIMENTO CIENTÍFICO E TECNOLÓGICO EM SAÚDE (INATIVO);RIO DE JANEIRO;NÃO;INATIVA;PRIVADA SEM FINS LUCRATIVOS;2025-10-23
3412;FUNDAÇÃO PARA O DESENVOLVIMENTO CIENTÍFICO E TECNOLÓGICO EM SAÚDE;RIO DE JANEIRO;NÃO;ATIVA;PRIVADA SEM FINS LUCRATIVOS;2025-10-23
3413;LCG BIOTECNOLOGIA E MONITÓRAMENTO AMBIENTAL LTDA-ME;MINAS GERAIS;NÃO;ATIVA;PRIVADA COM FINS LUCRATIVOS;2025-10-23
3414;SOCIEDADE BRASILEIRA DE PLANEJAMENTO ENERGETICO;MINAS GERAIS;NÃO;ATIVA;PRIVADA SEM FINS LUCRATIVOS;2025-10-23
3415;ESCOLA SUPERIOR DOM HELDER CAMARA;MINAS GERAIS;NÃO;ATIVA;PRIVADA SEM FINS LUCRATIVOS;2025-10-23
3416;FACULDADE DE CIENCIAS MEDICAS DE MINAS GERAIS;MINAS GERAIS;SIM;ATIVA;PRIVADA SEM FINS LUCRATIVOS;2025-10-23
3417;COMISSÃO NACIONAL DE ENERGIA NUCLEAR;RIO DE JANEIRO;SIM;ATIVA;PÚBLICA FEDERAL;2025-10-23
3418;ASSOCIAÇÃO MINEIRA DE PESQUISA E INICIAÇÃO CIENTÍFICA;MINAS GERAIS;NÃO;ATIVA;PRIVADA SEM FINS LUCRATIVOS;2025-10-23
3419;CENTRO DE ENSINO SUPERIOR DE SAO GOTARDO LTDA;MINAS GERAIS;NÃO;ATIVA;PRIVADA COM FINS LUCRATIVOS;2025-10-23
3420;UNIVERSIDADE VALE DO SAPUCAI - UNIVAS;MINAS GERAIS;NÃO;ATIVA;PRIVADA SEM FINS LUCRATIVOS;2025-10-23
3421;COOPERATIVA DOS APICULTORES E AGRICULTORES FAMILIARES DO NORTE DE MINAS;MINAS GERAIS;NÃO;ATIVA;OUTROS;2025-10-23
3422;LAMINATUS ENGENHARIA E INOVACAO EIRELI;MINAS GERAIS;NÃO;ATIVA;PRIVADA COM FINS LUCRATIVOS;2025-10-23
3423;BIO.INN LTDA;MINAS GERAIS;NÃO;ATIVA;PRIVADA COM FINS LUCRATIVOS;2025-10-23
3424;I - DELTA 4.0 LTDA;MINAS GERAIS;NÃO;ATIVA;PRIVADA COM FINS LUCRATIVOS;2025-10-23
3425;SIATEL SOLUCOES INTELIGENTES EM AUTOMACAO E TELECOMUNICACOES LTDA - ME;MINAS GERAIS;NÃO;ATIVA;PRIVADA COM FINS LUCRATIVOS;2025-10-23
3426;VMI SISTEMAS DE SEGURANCA LTDA;MINAS GERAIS;NÃO;ATIVA;PRIVADA COM FINS LUCRATIVOS;2025-10-23
3427;SHARENERGY ENGENHARIA E SERVICOS LTDA - ME;MINAS GERAIS;NÃO;ATIVA;PRIVADA COM FINS LUCRATIVOS;2025-10-23
3428;FLEX ENGENHARIA LTDA EPP;MINAS GERAIS;NÃO;ATIVA;PRIVADA COM FINS LUCRATIVOS;2025-10-23
3429;GF2 SOLUÇÕES INTEGRADAS EIRELLI - EPP;MINAS GERAIS;NÃO;ATIVA;PRIVADA COM FINS LUCRATIVOS;2025-10-23
3430;FCAMP CONSULTORIA EM SOLUCOES SUSTENTAVEIS LTDA;MINAS GERAIS;NÃO;ATIVA;PRIVADA COM FINS LUCRATIVOS;2025-10-23
3431;FLEX - DE LTDA EPP;MINAS GERAIS;NÃO;ATIVA;PRIVADA COM FINS LUCRATIVOS;2025-10-23
3432;VMI TECNOLOGIAS LTDA;MINAS GERAIS;NÃO;ATIVA;PRIVADA COM FINS LUCRATIVOS;2025-10-23
3433;ASSOCIAÇÃO BIOTECHTOWN OPEN LAB - INSTITUTO DE CIÊNCIA, TECNOLOGIA E INOVAÇÃO;MINAS GERAIS;NÃO;ATIVA;PRIVADA COM FINS LUCRATIVOS;2025-10-23
3434;CICLO CEAP LTDA;MINAS GERAIS;NÃO;ATIVA;PRIVADA COM FINS LUCRATIVOS;2025-10-23
3435;RENOVAGRO - AGRICULTURA RENOVAVEL S.A.;MINAS GERAIS;NÃO;ATIVA;PRIVADA COM FINS LUCRATIVOS;2025-10-23
3436;LABORATORIO DE ENSAIOS DE MONTE CARMELO LTDA - LEMC;MINAS GERAIS;NÃO;ATIVA;PRIVADA COM FINS LUCRATIVOS;2025-10-23
3437;SII INDUSTRIA E TECNOLOGIA LTDA;MINAS GERAIS;NÃO;ATIVA;PRIVADA COM FINS LUCRATIVOS;2025-10-23
3438;GEOLINE ENGENHARIA LTDA;MINAS GERAIS;NÃO;ATIVA;PRIVADA COM FINS LUCRATIVOS;2025-10-23
3439;PRONTO CAPITAL SECURITIZADORA S/A;MINAS GERAIS;NÃO;ATIVA;PRIVADA COM FINS LUCRATIVOS;2025-10-23
3440;LOGÍSTICA SOLUÇÕES DIGITAIS LTDA.;MINAS GERAIS;NÃO;ATIVA;PRIVADA COM FINS LUCRATIVOS;2025-10-23
3441;GOLD ANALISA DIAGNÓSTICA LTDA;MINAS GERAIS;NÃO;ATIVA;PRIVADA COM FINS LUCRATIVOS;2025-10-23
3442;SATIS INDUSTRIA E COMERCIO LTDA;MINAS GERAIS;NÃO;ATIVA;PRIVADA COM FINS LUCRATIVOS;2025-10-23
3443;GRANSENA EXPORTACAO E COMERCIO LTDA;MINAS GERAIS;NÃO;ATIVA;PRIVADA COM FINS LUCRATIVOS;2025-10-23
3444;BLIPS SOLUÇÔES EM ATIVOS LTDA;MINAS GERAIS;NÃO;ATIVA;PRIVADA COM FINS LUCRATIVOS;2025-10-23
3445;PEDSONO ATIVIDADES MÉDICAS LTDA;MINAS GERAIS;NÃO;ATIVA;PRIVADA COM FINS LUCRATIVOS;2025-10-23
3446;CHECKBITS CHECKLISTS INTELIGENTES LTDA;MINAS GERAIS;NÃO;ATIVA;PRIVADA COM FINS LUCRATIVOS;2025-10-23
3447;GENEAL DIAGNOSTICOS LTDA.;MINAS GERAIS;NÃO;ATIVA;PRIVADA COM FINS LUCRATIVOS;2025-10-23
3448;HARPIA HARPYJA SOLUCOES TECNOLOGICAS LTDA;MINAS GERAIS;NÃO;ATIVA;PRIVADA COM FINS LUCRATIVOS;2025-10-23
3449;SIEMATEC INFORMÁTICA;MINAS GERAIS;NÃO;ATIVA;PRIVADA COM FINS LUCRATIVOS;2025-10-23
3450;90 TECNOLOGIA DA INFORMACAO LTDA;MINAS GERAIS;NÃO;ATIVA;PRIVADA COM FINS LUCRATIVOS;2025-10-23
3451;SAMBA MOBILE MULTIMIDIA S/A;MINAS GERAIS;NÃO;ATIVA;PRIVADA COM FINS LUCRATIVOS;2025-10-23
3452;CONECTADENT SOLUÇÕES DIGITAIS LTDA;MINAS GERAIS;NÃO;ATIVA;PRIVADA COM FINS LUCRATIVOS;2025-10-23
3453;GRANTO CORRETORA DE SEGUROS;MINAS GERAIS;NÃO;ATIVA;PRIVADA COM FINS LUCRATIVOS;2025-10-23
3454;MICROBIOTEC PESQUISA, DESENVOLVIMENTO E ANALISES MICROBIOLOGICAS LTDA;MINAS GERAIS;NÃO;ATIVA;PRIVADA COM FINS LUCRATIVOS;2025-10-23
3455;HEALTHFUL TECHNOLOGY - SOLUCOES INTELIGENTES EM SAUDE LTDA;MINAS GERAIS;NÃO;ATIVA;PRIVADA COM FINS LUCRATIVOS;2025-10-23
3456;ALFA MED SISTEMAS MÉDICOS LTDA;MINAS GERAIS;NÃO;ATIVA;PRIVADA COM FINS LUCRATIVOS;2025-10-23
3457;ELECTRO SUSTENTABILIDADE LTDA;MINAS GERAIS;NÃO;ATIVA;PRIVADA COM FINS LUCRATIVOS;2025-10-23
3458;TELE COMUNICAÇÕES VALE DO RIO GRANDE LTDA;MINAS GERAIS;NÃO;ATIVA;PRIVADA COM FINS LUCRATIVOS;2025-10-23
3459;MARCEL AMORIM  - ME;MINAS GERAIS;NÃO;ATIVA;PRIVADA COM FINS LUCRATIVOS;2025-10-23
3460;ENTERPLAK PRODELETRONICOS LTDA;MINAS GERAIS;NÃO;ATIVA;PRIVADA COM FINS LUCRATIVOS;2025-10-23
3461;COOPERATIVA DOS RECOLHEDORES AUTONOMOS DE RESIDUOS SOLIDOS E MATERIAIS RECICLAVEIS DE UBERABA;MINAS GERAIS;NÃO;ATIVA;PRIVADA COM FINS LUCRATIVOS;2025-10-23
3462;SENXIS LTDA;MINAS GERAIS;NÃO;ATIVA;PRIVADA COM FINS LUCRATIVOS;2025-10-23
3463;BB SISTEMAS LTDA;MINAS GERAIS;NÃO;ATIVA;PRIVADA COM FINS LUCRATIVOS;2025-10-23
3464;42 CODELAB SOFTWARE LTDA;MINAS GERAIS;NÃO;ATIVA;PRIVADA COM FINS LUCRATIVOS;2025-10-23
3465;ATACADO OPTICO.COM.BR COMERCIO DE PRODUTOS OPTICOS - EIRELI - ME;MINAS GERAIS;NÃO;ATIVA;PRIVADA COM FINS LUCRATIVOS;2025-10-23
3466;SAGA MEDICAO SA;MINAS GERAIS;NÃO;ATIVA;PRIVADA COM FINS LUCRATIVOS;2025-10-23
3467;HRT MEDICINA AVANCADA EIRELI;MINAS GERAIS;NÃO;ATIVA;PRIVADA COM FINS LUCRATIVOS;2025-10-23
3468;KRIATIVAR EDUCACÃO E TECNOLOGIA LTDA;MINAS GERAIS;NÃO;ATIVA;PRIVADA COM FINS LUCRATIVOS;2025-10-23
3469;CADOMA SOLUCOES AUTOMATIZADAS LTDA;MINAS GERAIS;NÃO;ATIVA;PRIVADA COM FINS LUCRATIVOS;2025-10-23
3470;FFN SOLUÇÕES TECNOLÓGICAS;MINAS GERAIS;NÃO;ATIVA;PRIVADA COM FINS LUCRATIVOS;2025-10-23
3471;BARRA  PAPÉIS  INDÚSTRIA  E COMÉRCIO  LTDA;MINAS GERAIS;NÃO;ATIVA;PRIVADA COM FINS LUCRATIVOS;2025-10-23
3472;SAGATEC LTDA;MINAS GERAIS;NÃO;ATIVA;PRIVADA COM FINS LUCRATIVOS;2025-10-23
3473;CARGO SAPIENS SOFTWARE LTDA;MINAS GERAIS;NÃO;ATIVA;PRIVADA COM FINS LUCRATIVOS;2025-10-23
3474;LEAVES ENGENHARIA E SOLUÇÕES AMBIENTAIS LTDA;MINAS GERAIS;NÃO;ATIVA;PRIVADA COM FINS LUCRATIVOS;2025-10-23
3475;TREINUS TECNOLOGIA E SERVICOS LTDA;MINAS GERAIS;NÃO;ATIVA;PRIVADA COM FINS LUCRATIVOS;2025-10-23
3476;PRICE SURVEY - INTELIGENCIA DE MERCADO LTDA;MINAS GERAIS;NÃO;ATIVA;PRIVADA COM FINS LUCRATIVOS;2025-10-23
3477;SII INDUSTRIA E TECNOLOGIA LTDA - ME;MINAS GERAIS;NÃO;INATIVA;PRIVADA COM FINS LUCRATIVOS;2025-10-23
3478;ACTUAL CONSULTORIA EM COMUNICAÇÃO LTDA.;MINAS GERAIS;NÃO;ATIVA;PRIVADA COM FINS LUCRATIVOS;2025-10-23
3479;PARTNER BANK PAGAMENTOS S/A;MINAS GERAIS;NÃO;ATIVA;PRIVADA COM FINS LUCRATIVOS;2025-10-23
3480;CAPSARIUM PROJETOS LTDA;MINAS GERAIS;NÃO;ATIVA;ENTIDADE CONFESSIONAL;2025-10-23
3481;ONEX DATA CENTERS LTDA;MINAS GERAIS;NÃO;ATIVA;PRIVADA COM FINS LUCRATIVOS;2025-10-23
3482;FORDOCTOR CONTABILIDADE LTDA;MINAS GERAIS;NÃO;ATIVA;PRIVADA COM FINS LUCRATIVOS;2025-10-23
3483;SINSTEL LTDA;MINAS GERAIS;NÃO;ATIVA;PRIVADA COM FINS LUCRATIVOS;2025-10-23
3484;GAMEFIK INDUSTRIA, COMERCIO E SERVICOS LTDA;MINAS GERAIS;NÃO;ATIVA;PRIVADA COM FINS LUCRATIVOS;2025-10-23
3485;ENTERPLAK PRODUTOS ELETRÔNICOS LTDA;MINAS GERAIS;NÃO;ATIVA;PRIVADA COM FINS LUCRATIVOS;2025-10-23
3486;ULTRAPÃO ALIMENTOS INDÚSTRIA DE ALIMENTOS CONGELADOS S/A;MINAS GERAIS;NÃO;ATIVA;OUTROS;2025-10-23
3487;UNIVERSIDADE TECNOLÓGICA FEDERAL DO PARANÁ;PARANÁ;NÃO;ATIVA;OUTROS;2025-10-23
3488;MELVIN SOLUCOES EM SOFTWARE LTDA;MINAS GERAIS;NÃO;ATIVA;PRIVADA COM FINS LUCRATIVOS;2025-10-23
3489;EXPRESSO PLANALTO TRANSPORTE E LOGISTICA LTDA;MINAS GERAIS;NÃO;ATIVA;PRIVADA COM FINS LUCRATIVOS;2025-10-23
3490;TERRA VIVA RECUPERAÇÃO DE RESÍDUOS MINERAIS LTDA;MINAS GERAIS;NÃO;ATIVA;PRIVADA COM FINS LUCRATIVOS;2025-10-23
3491;RD TECNOLOGIA EM MOBILIDADE LTDA;MINAS GERAIS;NÃO;ATIVA;PRIVADA COM FINS LUCRATIVOS;2025-10-23
3492;BRICKUP LTDA;MINAS GERAIS;NÃO;ATIVA;PRIVADA COM FINS LUCRATIVOS;2025-10-23
3493;M.CHEDIAK SOLUCOES & PESQUISAS;MINAS GERAIS;NÃO;ATIVA;PRIVADA COM FINS LUCRATIVOS;2025-10-23
3494;JF TECNOLOGIA, INOVAÇÃO E PESQUISA LTDA.;MINAS GERAIS;NÃO;ATIVA;PRIVADA COM FINS LUCRATIVOS;2025-10-23
3495;SATYA SISTEMAS LTDA - ME;MINAS GERAIS;NÃO;ATIVA;PRIVADA COM FINS LUCRATIVOS;2025-10-23
3496;LOGPYX TECNOLOGIA S/A;MINAS GERAIS;NÃO;ATIVA;PRIVADA COM FINS LUCRATIVOS;2025-10-23
3497;ASSOCIAÇÃO ÓRBI CONECTA;MINAS GERAIS;SIM;ATIVA;PRIVADA SEM FINS LUCRATIVOS;2025-10-23
3498;I & P PROJETOS;MINAS GERAIS;NÃO;ATIVA;PRIVADA COM FINS LUCRATIVOS;2025-10-23
3499;VIAÇÃO ITAPETINGA LTDA;MINAS GERAIS;NÃO;ATIVA;PRIVADA COM FINS LUCRATIVOS;2025-10-23
3500;SAFFRAN REFRATARIOS LTDA;MINAS GERAIS;NÃO;ATIVA;PRIVADA COM FINS LUCRATIVOS;2025-10-23
3501;TERRAQ SOLUCOES TECNOLOGICAS LTDA;MINAS GERAIS;NÃO;ATIVA;PRIVADA COM FINS LUCRATIVOS;2025-10-23
3502;URZEDO RAVAGNANI SENE ENGENHARIA LTDA;MINAS GERAIS;NÃO;ATIVA;PRIVADA COM FINS LUCRATIVOS;2025-10-23
3503;GRIDER AUTOMACAO E TECNOLOGIA LTDA;MINAS GERAIS;NÃO;ATIVA;PRIVADA COM FINS LUCRATIVOS;2025-10-23
3504;2MATHS LTDA;MINAS GERAIS;NÃO;ATIVA;PRIVADA COM FINS LUCRATIVOS;2025-10-23
3505;C & R AGRO AMBIENTAL CONSULTORIA LTDA;MINAS GERAIS;NÃO;ATIVA;PRIVADA COM FINS LUCRATIVOS;2025-10-23
3506;METROPOLE 4 MIDIA DE INFLUENCIA LTDA;MINAS GERAIS;NÃO;ATIVA;PRIVADA COM FINS LUCRATIVOS;2025-10-23
3507;SAPIENS INTELIGÊNCIA LTDA ME;MINAS GERAIS;NÃO;ATIVA;PRIVADA COM FINS LUCRATIVOS;2025-10-23
3508;BLOSSOM CONSULTORIA E ASSESSORIA SA;MINAS GERAIS;NÃO;ATIVA;PRIVADA COM FINS LUCRATIVOS;2025-10-23
3509;CONSTRUTORA SUDOESTE LTDA;MINAS GERAIS;NÃO;ATIVA;PRIVADA COM FINS LUCRATIVOS;2025-10-23
3510;LM INSIGHT LTDA;MINAS GERAIS;NÃO;ATIVA;PRIVADA COM FINS LUCRATIVOS;2025-10-23
3511;PAGAR LTDA;MINAS GERAIS;NÃO;ATIVA;PRIVADA COM FINS LUCRATIVOS;2025-10-23
3512;GONTIJO ENGENHARIA E FUNDACOES ESPECIAIS LTDA;MINAS GERAIS;NÃO;INATIVA;PRIVADA COM FINS LUCRATIVOS;2025-10-23
3513;ROTULUS LTDA;MINAS GERAIS;NÃO;ATIVA;PRIVADA COM FINS LUCRATIVOS;2025-10-23
3514;LOOG TECH LTDA;MINAS GERAIS;NÃO;ATIVA;PRIVADA COM FINS LUCRATIVOS;2025-10-23
3515;THIAGO COUTO DE ANDRADE GOIS;MINAS GERAIS;NÃO;ATIVA;PRIVADA COM FINS LUCRATIVOS;2025-10-23
3516;CLIENTE FIEL DESENVOLVIMENTO MOBILE LTDA;MINAS GERAIS;NÃO;ATIVA;PRIVADA COM FINS LUCRATIVOS;2025-10-23
3517;AIRED INOVAÇÃO EM GEOTECNOLOGIA LTDA;MINAS GERAIS;NÃO;ATIVA;PRIVADA COM FINS LUCRATIVOS;2025-10-23
3518;INVISION INDUSTRIA E COMERCIO DE DISPOSITIVOS MEDICOS EIRELI;MINAS GERAIS;NÃO;ATIVA;PRIVADA COM FINS LUCRATIVOS;2025-10-23
3519;MAIA E REIS JUNIOR DESENVOLVIMENTO LTDA;MINAS GERAIS;NÃO;ATIVA;PRIVADA COM FINS LUCRATIVOS;2025-10-23
3520;HAGRO BRASIL LTDA;MINAS GERAIS;NÃO;ATIVA;PRIVADA COM FINS LUCRATIVOS;2025-10-23
3521;SUL ADUANEIRA IMPORTAÇÃO E EXPORTAÇÃO LTDA;MINAS GERAIS;NÃO;ATIVA;PRIVADA COM FINS LUCRATIVOS;2025-10-23
3522;TVRT BRAZIL COFFEES;MINAS GERAIS;NÃO;ATIVA;PRIVADA COM FINS LUCRATIVOS;2025-10-23
3523;INFLAME TECNOLOGIA LTDA,;MINAS GERAIS;NÃO;ATIVA;PRIVADA COM FINS LUCRATIVOS;2025-10-23
3524;INCENTIVAR CONSULTORES LTDA;MINAS GERAIS;NÃO;ATIVA;PRIVADA COM FINS LUCRATIVOS;2025-10-23
3525;ADVANCED ENGENHARIA E TECNOLOGIA LTDA;MINAS GERAIS;NÃO;ATIVA;PRIVADA COM FINS LUCRATIVOS;2025-10-23
3526;QUASAR DESENVOLVIMENTO DE SISTEMAS INTELIGENTES DE GESTÃO LTDA;MINAS GERAIS;NÃO;ATIVA;PRIVADA COM FINS LUCRATIVOS;2025-10-23
3527;DGE DESENVOLVIMENTO DE SOFTWARE LTDA;MINAS GERAIS;NÃO;ATIVA;PRIVADA COM FINS LUCRATIVOS;2025-10-23
3528;METALÚRGICA SOARES INDÚSTRIA E COMÉRCIO LTDA;MINAS GERAIS;NÃO;ATIVA;PRIVADA COM FINS LUCRATIVOS;2025-10-23
3529;CAMAGUI ADMINISTRAÇÃO E SERVIÇOS LTDA - ME;MINAS GERAIS;NÃO;ATIVA;PRIVADA COM FINS LUCRATIVOS;2025-10-23
3530;NEOGEO GEOTECNOLOGIA LTDA;MINAS GERAIS;NÃO;ATIVA;PRIVADA COM FINS LUCRATIVOS;2025-10-23
3531;ICE EDUCAÇÃO E MARKETING LTDA.;MINAS GERAIS;NÃO;ATIVA;PRIVADA COM FINS LUCRATIVOS;2025-10-23
3532;MYVISION SOLUCOES LTDA - ME;MINAS GERAIS;NÃO;ATIVA;PRIVADA COM FINS LUCRATIVOS;2025-10-23
3533;CONTROL FLUX MATERIAIS ELÉTRICOS LTDA.;MINAS GERAIS;NÃO;ATIVA;PRIVADA COM FINS LUCRATIVOS;2025-10-23
3534;AUDIT BRASIL LTDA;MINAS GERAIS;NÃO;ATIVA;PRIVADA COM FINS LUCRATIVOS;2025-10-23
3535;AGÊNCIA FLOW INOVAÇÃO E DESIGN LTDA;MINAS GERAIS;NÃO;ATIVA;PRIVADA COM FINS LUCRATIVOS;2025-10-23
3536;RR INOVA SERVIÇOS EMPRESARIAIS LTDA.;MINAS GERAIS;NÃO;ATIVA;PRIVADA COM FINS LUCRATIVOS;2025-10-23
3537;WANTU EDUCAÇÃO E DESENVOLVIMENTO LTDA.;MINAS GERAIS;NÃO;ATIVA;PRIVADA COM FINS LUCRATIVOS;2025-10-23
3538;AGROPECUÁRIA SERTÃO LTDA.;MINAS GERAIS;NÃO;ATIVA;PRIVADA COM FINS LUCRATIVOS;2025-10-23
3539;SIMPLIFICA FRETES LTDA - ME;MINAS GERAIS;NÃO;ATIVA;PRIVADA COM FINS LUCRATIVOS;2025-10-23
3540;FERNANDO SILVEIRA DESENVOLVIMENTO E GESTAO EMPRESARIAL LTDA.;MINAS GERAIS;NÃO;ATIVA;PRIVADA COM FINS LUCRATIVOS;2025-10-23
3541;CLIQUEI ACHEI SERVICOS DE INFORMACAO NA INTERNET LTDA;MINAS GERAIS;NÃO;ATIVA;PRIVADA SEM FINS LUCRATIVOS;2025-10-23
3542;CITUR.PC SPE LTDA.;MINAS GERAIS;NÃO;ATIVA;PRIVADA COM FINS LUCRATIVOS;2025-10-23
3543;VINICOLA ARPURO LTDA;MINAS GERAIS;NÃO;ATIVA;PRIVADA COM FINS LUCRATIVOS;2025-10-23
3544;DIREITIVO TECNOLOGIAS AVANCADAS LTDA;MINAS GERAIS;NÃO;ATIVA;PRIVADA COM FINS LUCRATIVOS;2025-10-23
3545;PAROLINI CONEXÕES EMPRESARIAIS LTDA;MINAS GERAIS;NÃO;ATIVA;PRIVADA COM FINS LUCRATIVOS;2025-10-23
3546;COLETIVOS RIO BRANCO LTDA -ME;MINAS GERAIS;NÃO;ATIVA;PRIVADA COM FINS LUCRATIVOS;2025-10-23
3547;STORERAISER TECNOLOGIA LTDA;MINAS GERAIS;NÃO;ATIVA;PRIVADA COM FINS LUCRATIVOS;2025-10-23
3548;AMEL ADMINISTRADOR DE CARTÕES S/A;MINAS GERAIS;NÃO;ATIVA;PRIVADA COM FINS LUCRATIVOS;2025-10-23
3549;VIDAVEG S.A;MINAS GERAIS;NÃO;ATIVA;PRIVADA COM FINS LUCRATIVOS;2025-10-23
3550;27.964.644 JOEDSON MOREIRA GIFFONI;MINAS GERAIS;NÃO;ATIVA;PRIVADA COM FINS LUCRATIVOS;2025-10-23
3551;KONTIX ORGANIZAÇÃO CONTABIL LTDA;MINAS GERAIS;NÃO;ATIVA;PRIVADA COM FINS LUCRATIVOS;2025-10-23
3552;RUHTECH SOFTWARE E HARDWARE LTDA;MINAS GERAIS;NÃO;ATIVA;PRIVADA COM FINS LUCRATIVOS;2025-10-23
3553;SMARTIS SOLUCOES EM SOFTWARE LTDA;MINAS GERAIS;NÃO;ATIVA;PRIVADA COM FINS LUCRATIVOS;2025-10-23
3554;UP VENDAS GESTÃO DE PAGAMENTOS SA;MINAS GERAIS;NÃO;ATIVA;PRIVADA COM FINS LUCRATIVOS;2025-10-23
