identificador;nome_instituicao;estado;lct;situacao;tipo_instituicao;datadisponibilizacao
2609;DBMÍDIA TECNOLOGIA DA INFORMAÇÃO E CONSULTORIA LTDA;MINAS GERAIS;NÃO;INATIVA;PRIVADA COM FINS LUCRATIVOS;2025-10-23
2610;INSTITUTO DE GESTÃO EM TECNOLOGIA DA INFORMAÇÃO;MINAS GERAIS;NÃO;INATIVA;PRIVADA COM FINS LUCRATIVOS;2025-10-23
2611;MUTABILE ARQUITETURA LTDA;MINAS GERAIS;NÃO;INATIVA;PRIVADA COM FINS LUCRATIVOS;2025-10-23
2612;INOXCOLOR AÇOS INOXIDÁVEIS COLORIDOS LTDA;MINAS GERAIS;NÃO;INATIVA;PRIVADA COM FINS LUCRATIVOS;2025-10-23
2613;MYLEUS PESQUISA E DESENVOLVIMENTO LTDA. ME;MINAS GERAIS;NÃO;INATIVA;PRIVADA COM FINS LUCRATIVOS;2025-10-23
2614;OMNILOGIC SOLUÇÕES INTELIGENTES LTDA;MINAS GERAIS;NÃO;INATIVA;PRIVADA COM FINS LUCRATIVOS;2025-10-23
2615;ENGENHARIA ASSISTIDA POR COMPUTADOR LTDA  - EPP;MINAS GERAIS;NÃO;ATIVA;PRIVADA COM FINS LUCRATIVOS;2025-10-23
2616;ENZYTEC CONSULTORIA EM BIOTECNOLOGIA LTDA;MINAS GERAIS;NÃO;INATIVA;PRIVADA COM FINS LUCRATIVOS;2025-10-23
2617;MINASTEC PROJETOS E CONSULTORIA LTDA;MINAS GERAIS;NÃO;INATIVA;PRIVADA COM FINS LUCRATIVOS;2025-10-23
2618;REDE ASSESSORIA EM COMUNICAÇÃO LTDA;MINAS GERAIS;NÃO;INATIVA;PRIVADA COM FINS LUCRATIVOS;2025-10-23
2619;RENNOSONIC TECNOLOGIA LTDA;MINAS GERAIS;NÃO;INATIVA;PRIVADA COM FINS LUCRATIVOS;2025-10-23
2620;BTS BIOTECNOLOGIA LTDA;MINAS GERAIS;NÃO;INATIVA;PRIVADA COM FINS LUCRATIVOS;2025-10-23
2621;ACROTECH SEMENTES E REFLORESTAMENTO LTDA;MINAS GERAIS;NÃO;INATIVA;PRIVADA COM FINS LUCRATIVOS;2025-10-23
2622;SOLEM TEC - SOLUÇÕES EM PAGAMENTOS;MINAS GERAIS;NÃO;INATIVA;PRIVADA COM FINS LUCRATIVOS;2025-10-23
2623;VALLÉE SA;MINAS GERAIS;NÃO;INATIVA;PRIVADA COM FINS LUCRATIVOS;2025-10-23
2624;REZEK FERREIRA INFORMÁTICA LTDA;MINAS GERAIS;NÃO;ATIVA;PRIVADA COM FINS LUCRATIVOS;2025-10-23
2625;FJ TECNOLOGIA;MINAS GERAIS;NÃO;INATIVA;PRIVADA COM FINS LUCRATIVOS;2025-10-23
2626;PRIS TECNOLOGIA LTDA;MINAS GERAIS;NÃO;INATIVA;PRIVADA COM FINS LUCRATIVOS;2025-10-23
2627;AULAFLEX EDUCACIONAL LTDA - ME;MINAS GERAIS;NÃO;INATIVA;PRIVADA COM FINS LUCRATIVOS;2025-10-23
2628;BRAVIR INDUSTRIAL LTDA;MINAS GERAIS;NÃO;INATIVA;PRIVADA COM FINS LUCRATIVOS;2025-10-23
2629;LEGON TECNOLOGIA INDÚSTRIA E COMÉRCIO DE ELETRÔNICOS LTDA. - ME;MINAS GERAIS;NÃO;INATIVA;PRIVADA COM FINS LUCRATIVOS;2025-10-23
2630;ECOSOLUÇÕES ASSESSORIA E CONSULTORIA EM DESENVOLVIMENTO SUSTENTÁVEL LTDA.;MINAS GERAIS;NÃO;INATIVA;PRIVADA COM FINS LUCRATIVOS;2025-10-23
2631;OUROX ENGENHARIA LTDA;MINAS GERAIS;NÃO;INATIVA;PRIVADA COM FINS LUCRATIVOS;2025-10-23
2632;SENERGY SISTEMAS DE MEDIÇÃO;MINAS GERAIS;NÃO;INATIVA;PRIVADA COM FINS LUCRATIVOS;2025-10-23
2633;INTELIGÊNCIA EM TECNOLOGIA & MERCADO LTDA;MINAS GERAIS;NÃO;INATIVA;PRIVADA COM FINS LUCRATIVOS;2025-10-23
2635;AUGE TECNOLOGIA E SISTEMAS;MINAS GERAIS;NÃO;INATIVA;PRIVADA COM FINS LUCRATIVOS;2025-10-23
2636;VOÇOSA NATURAL LAB LTDA;MINAS GERAIS;NÃO;INATIVA;PRIVADA COM FINS LUCRATIVOS;2025-10-23
2637;T3 - INFORMATICA APLICADA LTDA;MINAS GERAIS;NÃO;ATIVA;PRIVADA COM FINS LUCRATIVOS;2025-10-23
2638;SPEED-E EMPREENDEDORISMO E ACELERAÇÃO DE EMPRESAS LTDA;MINAS GERAIS;NÃO;INATIVA;PRIVADA COM FINS LUCRATIVOS;2025-10-23
2640;A-1 TECNOLOGIA E TELEMETRIA LTDA;MINAS GERAIS;NÃO;INATIVA;PRIVADA COM FINS LUCRATIVOS;2025-10-23
2641;PENTAGRAMA CONSULTORIA E SISTEMAS LTDA;MINAS GERAIS;NÃO;INATIVA;PRIVADA COM FINS LUCRATIVOS;2025-10-23
2642;NATURAL NECTAR USINA DE SAÚDE LTDA;MINAS GERAIS;NÃO;INATIVA;PRIVADA COM FINS LUCRATIVOS;2025-10-23
2643;PROBIOTEC INDUSTRIA E COMÉRCIO KITS DE DIAGNOSTICOS PARA SAÚDE LTDA;MINAS GERAIS;NÃO;INATIVA;PRIVADA COM FINS LUCRATIVOS;2025-10-23
2644;BIHARCK GROUP INFORMÁTICA LTDA ME;MINAS GERAIS;NÃO;INATIVA;PRIVADA COM FINS LUCRATIVOS;2025-10-23
2645;AXOON SOLUÇÕES TECNOLÓGICAS EM SAÚDE LTDA;MINAS GERAIS;NÃO;INATIVA;PRIVADA COM FINS LUCRATIVOS;2025-10-23
2646;SITEWARE SOLUÇÕES S/C LTDA;MINAS GERAIS;NÃO;INATIVA;PRIVADA COM FINS LUCRATIVOS;2025-10-23
2647;INSTITUTO QUALIDADE E PRODUTIVIDADE DE MINAS;MINAS GERAIS;NÃO;INATIVA;PRIVADA SEM FINS LUCRATIVOS;2025-10-23
2648;PREFEITURA MUNICIPAL DE MONTES CLAROS;MINAS GERAIS;NÃO;INATIVA;PÚBLICA MUNICIPAL;2025-10-23
2649;MTW ARQUITETURA LTDA;MINAS GERAIS;NÃO;INATIVA;PÚBLICA MUNICIPAL;2025-10-23
2650;M. I. MONTREAL INFORMATICA LTDA;MINAS GERAIS;NÃO;INATIVA;PRIVADA COM FINS LUCRATIVOS;2025-10-23
2651;GARCIA COSTA PRODUÇÕES VISUAIS E COMÉRCIO DE PRODUTOS ALIMENTÍCIOS LTDA;MINAS GERAIS;NÃO;INATIVA;PRIVADA COM FINS LUCRATIVOS;2025-10-23
2652;FUNDAÇÃO SANTO AGOSTINHO DE MONTES CLAROS;MINAS GERAIS;NÃO;INATIVA;PRIVADA SEM FINS LUCRATIVOS;2025-10-23
2653;CENTRO DE PRODUÇÕES TÉCNICAS E EDITORA LTDA;MINAS GERAIS;NÃO;INATIVA;PRIVADA COM FINS LUCRATIVOS;2025-10-23
2654;IE TECNOLOGIA LTDA;MINAS GERAIS;NÃO;ATIVA;PRIVADA COM FINS LUCRATIVOS;2025-10-23
2655;ESCOLA SATÉLITE LTDA;MINAS GERAIS;NÃO;INATIVA;PRIVADA COM FINS LUCRATIVOS;2025-10-23
2656;CENTRO SUPERIOR DE ESTUDOS DE MANHUAÇU LTDA - FACULDADE DE CIÊNCIAS GERENCIAIS DE MANHUAÇU;MINAS GERAIS;NÃO;INATIVA;PRIVADA COM FINS LUCRATIVOS;2025-10-23
2657;H2ON TECNOLOGIA LTDA - ME;MINAS GERAIS;NÃO;INATIVA;PRIVADA COM FINS LUCRATIVOS;2025-10-23
2658;ASSOCIAÇÃO DE PROTEÇÃO AMBIENTAL DA BACIA DO RIBEIRÃO IPANEMA;MINAS GERAIS;NÃO;INATIVA;PRIVADA SEM FINS LUCRATIVOS;2025-10-23
2659;CLONAR RESISTÊNCIA A DOENÇAS FLORESTAIS LTDA;MINAS GERAIS;NÃO;ATIVA;PRIVADA COM FINS LUCRATIVOS;2025-10-23
2660;INSTITUTO ARTES DAS AMÉRICAS;MINAS GERAIS;NÃO;INATIVA;PRIVADA SEM FINS LUCRATIVOS;2025-10-23
2661;C/ ARTE PROJETOS CULTURAIS LTDA;MINAS GERAIS;NÃO;INATIVA;PRIVADA COM FINS LUCRATIVOS;2025-10-23
2662;"FUNDAÇÃO DONA MINDOCA RENNO MOREIRA/ESCOLA TÉCNICA DE ELETRÔNICA ""FRANCISCO MOREIRA DA COSTA""";MINAS GERAIS;NÃO;ATIVA;PRIVADA SEM FINS LUCRATIVOS;2025-10-23
2663;INSTITUTO MINEIRO DE EDUCAÇÃO E CULTURA UNI-BH S/A / CENTRO UNIVERSITÁRIO DE BELO HORIZONTE;MINAS GERAIS;NÃO;INATIVA;PRIVADA COM FINS LUCRATIVOS;2025-10-23
2665;FUNDAÇÃO MINEIRA PARA O  DESENVOLVIMENTO HOSPITALAR;MINAS GERAIS;NÃO;INATIVA;PRIVADA SEM FINS LUCRATIVOS;2025-10-23
2666;CENTRO INTERDICIPLINAR DE ASSISTÊNCIA E PESQUISA EM ENVELHECIMENTO;MINAS GERAIS;NÃO;INATIVA;PRIVADA SEM FINS LUCRATIVOS;2025-10-23
2667;FUNDAÇÃO ROGE;MINAS GERAIS;NÃO;INATIVA;PRIVADA SEM FINS LUCRATIVOS;2025-10-23
2668;PROJETU QUALIFICAÇÃO PROFISSIONAL E CONSULTORIA LTDA;MINAS GERAIS;NÃO;INATIVA;PRIVADA COM FINS LUCRATIVOS;2025-10-23
2669;FUNDAÇÃO JOSÉ FERNANDES DE ARAÚJO;MINAS GERAIS;NÃO;INATIVA;PRIVADA SEM FINS LUCRATIVOS;2025-10-23
2670;INSTITUTO GUALTER DE MOURA ALVES;MINAS GERAIS;NÃO;INATIVA;PRIVADA SEM FINS LUCRATIVOS;2025-10-23
2671;INSTITUTO PARA PRÁTICAS SEGURAS NO USO DE MEDICAMENTOS;MINAS GERAIS;NÃO;INATIVA;PRIVADA SEM FINS LUCRATIVOS;2025-10-23
2672;FUNDAÇÃO CULTURAL ALFREDO FERREIRA LAGE;MINAS GERAIS;NÃO;INATIVA;PRIVADA SEM FINS LUCRATIVOS;2025-10-23
2673;MOBART INFORMÁTICA LTDA;MINAS GERAIS;NÃO;INATIVA;PRIVADA COM FINS LUCRATIVOS;2025-10-23
2674;FACULDADE DE SAÚDE DE IBITURUNA;MINAS GERAIS;NÃO;INATIVA;PRIVADA COM FINS LUCRATIVOS;2025-10-23
2675;INOVA SOFT INFORMÁTICA;MINAS GERAIS;NÃO;INATIVA;PRIVADA COM FINS LUCRATIVOS;2025-10-23
2676;CLIO MUSEU DE CULTURA MATERIAL LTDA - CADASTRO EXCLUIDO;MINAS GERAIS;NÃO;INATIVA;PRIVADA COM FINS LUCRATIVOS;2025-10-23
2677;ASSOCIAÇÃO MINEIRA DE PESQUISA;MINAS GERAIS;NÃO;INATIVA;PRIVADA SEM FINS LUCRATIVOS;2025-10-23
2678;KATAL BIOTECNOLOGIA INDÚSTRIA E COMÉRCIO LTDA;MINAS GERAIS;NÃO;INATIVA;PRIVADA COM FINS LUCRATIVOS;2025-10-23
2679;PROSPECTA - PLANEJAMENTO E CONSULTORIA LTDA.;MINAS GERAIS;NÃO;INATIVA;PRIVADA COM FINS LUCRATIVOS;2025-10-23
2680;AMBIENTE BRASIL CENTRO DE ESTUDOS;MINAS GERAIS;NÃO;INATIVA;PRIVADA SEM FINS LUCRATIVOS;2025-10-23
2681;INSTITUTO ALCANÇAR;MINAS GERAIS;NÃO;INATIVA;PRIVADA SEM FINS LUCRATIVOS;2025-10-23
2682;AXIS AEROESPACIAL LTDA;MINAS GERAIS;NÃO;INATIVA;PRIVADA COM FINS LUCRATIVOS;2025-10-23
2683;SINDICATO DAS EMPRESAS DE PROC. DE DADOS, INF., SOFTWARE E SERVIÇOS EM TECNOLOGIA DA INF. DO EST. MG;MINAS GERAIS;NÃO;INATIVA;PRIVADA SEM FINS LUCRATIVOS;2025-10-23
2684;INSTITUTO DE INVESTIGAÇÕES AGROPECUÁRIAS;MINAS GERAIS;NÃO;INATIVA;PRIVADA COM FINS LUCRATIVOS;2025-10-23
2685;SECRETARIA DE ESTADO DE DESENVOLVIMENTO SOCIAL;MINAS GERAIS;NÃO;INATIVA;PÚBLICA ESTADUAL;2025-10-23
2686;ENTABAN ECOENERGÉTICAS DO BRASIL LTDA.;MINAS GERAIS;NÃO;INATIVA;PRIVADA COM FINS LUCRATIVOS;2025-10-23
2687;INSTITUTO DA ATENÇÃO SOCIAL INTEGRADA;MINAS GERAIS;NÃO;INATIVA;PRIVADA SEM FINS LUCRATIVOS;2025-10-23
2688;FUNDAÇÃO FAFILE DE CARANGOLA;MINAS GERAIS;NÃO;INATIVA;PRIVADA SEM FINS LUCRATIVOS;2025-10-23
2689;RECURSOS HUMANOS NO AGRONEGÓCIO LTDA.;MINAS GERAIS;NÃO;ATIVA;PRIVADA COM FINS LUCRATIVOS;2025-10-23
2690;CENTERTEL LTDA.;MINAS GERAIS;NÃO;INATIVA;PRIVADA COM FINS LUCRATIVOS;2025-10-23
2691;AGÊNCIA NACIONAL DE GESTÃO DE CONHECIMENTO E INOVAÇÃO;MINAS GERAIS;NÃO;INATIVA;PRIVADA SEM FINS LUCRATIVOS;2025-10-23
2692;SOCIEDADE DOM BOSCO DE EDUCAÇÃO E CULTURA LTDA.;MINAS GERAIS;NÃO;INATIVA;PRIVADA COM FINS LUCRATIVOS;2025-10-23
2693;INSTITUTO KAPTA DE PESQUSIA, CONSULTORIA E TREINAMENTO LTDA.;MINAS GERAIS;NÃO;INATIVA;PRIVADA COM FINS LUCRATIVOS;2025-10-23
2694;ASSOCIAÇÃO DOS AMIGOS DO MUSEU  DA PROPAGANDA;MINAS GERAIS;NÃO;INATIVA;PRIVADA SEM FINS LUCRATIVOS;2025-10-23
2695;INSTITUTO NACIONAL DE METROLOGIA, NORMALIZAÇÃO E QUALIDADE INDUSTRIAL;RIO DE JANEIRO;NÃO;INATIVA;PÚBLICA FEDERAL;2025-10-23
2696;AMAURI JERONYMO ME;MINAS GERAIS;NÃO;ATIVA;PRIVADA COM FINS LUCRATIVOS;2025-10-23
2697;THE UNIVERSITY OF QUEENSLAND;MINAS GERAIS;NÃO;ATIVA;OUTROS;2025-10-23
2698;FUNDAÇÃO INSTITUTO CLÍNICO DE JUIZ DE FORA;MINAS GERAIS;NÃO;INATIVA;PRIVADA SEM FINS LUCRATIVOS;2025-10-23
2699;INSTITUTO;MINAS GERAIS;NÃO;ATIVA;PRIVADA SEM FINS LUCRATIVOS;2025-10-23
2700;INSTITUIÇÃO EDUCACIONAL CECÍLIA MARIA DE MELO BARCELOS LTDA/FACULDADE ASA DE BRUMADINHO;MINAS GERAIS;NÃO;ATIVA;PRIVADA COM FINS LUCRATIVOS;2025-10-23
2701;IETEC - INSTITUTO DE EDUCAÇÃO TECNOLÓGICA EIRELI;MINAS GERAIS;NÃO;INATIVA;PRIVADA COM FINS LUCRATIVOS;2025-10-23
2702;INSTITUTO DE DESENVOLVIMENTO EDUCACIONAL AVANÇADO LTDA/ESCOLA SUPERIOR DE ADMINISTRAÇÃO;MINAS GERAIS;NÃO;INATIVA;PRIVADA COM FINS LUCRATIVOS;2025-10-23
2703;INSTITUTO DE IMUNOLOGIA APLICADA LTDA;MINAS GERAIS;NÃO;INATIVA;PRIVADA COM FINS LUCRATIVOS;2025-10-23
2704;AGÊNCIA DE DESENVOLVIMENTO DA REGIÃO METROPOLITANA DE BELO HORIZONTE;MINAS GERAIS;NÃO;INATIVA;PÚBLICA ESTADUAL;2025-10-23
2705;UNIÃO DE ENSINO SUPERIOR DE VIÇOSA LTDA;MINAS GERAIS;NÃO;ATIVA;PRIVADA COM FINS LUCRATIVOS;2025-10-23
2706;CÓDON BIOTECNOLOGIA LTDA;MINAS GERAIS;NÃO;INATIVA;PRIVADA COM FINS LUCRATIVOS;2025-10-23
2707;VISION DESENVOLVIMENTO DE SOLUÇÕES TECNOLÓGICAS LTDA;MINAS GERAIS;NÃO;INATIVA;PRIVADA COM FINS LUCRATIVOS;2025-10-23
2708;INJETEC INDÚSTRIA E COMÉRCIO LTDA;MINAS GERAIS;NÃO;INATIVA;PRIVADA COM FINS LUCRATIVOS;2025-10-23
2709;SINDICATO DO COMÉRCIO VAREJISTA DE GÊNEROS ALIMENTÍCIOS DE BELO HORIZONTE;MINAS GERAIS;NÃO;INATIVA;PRIVADA SEM FINS LUCRATIVOS;2025-10-23
2710;ASSOCIAÇÃO DOS CAFEICULTORES DE ARAGUARI;MINAS GERAIS;NÃO;INATIVA;PRIVADA SEM FINS LUCRATIVOS;2025-10-23
2711;MAIS INFORMÁTICA LTDA;MINAS GERAIS;NÃO;INATIVA;PRIVADA COM FINS LUCRATIVOS;2025-10-23
2712;METHANUM ENGENHARIA AMBIENTAL LTDA;MINAS GERAIS;NÃO;INATIVA;PRIVADA COM FINS LUCRATIVOS;2025-10-23
2713;FLEMING PROCESSAMENTO DE DADOS LTDA;MINAS GERAIS;NÃO;INATIVA;PRIVADA COM FINS LUCRATIVOS;2025-10-23
2714;ACESSOTI TECNOLOGIA DA INFORMAÇÃO LTDA;MINAS GERAIS;NÃO;INATIVA;PRIVADA COM FINS LUCRATIVOS;2025-10-23
2715;SOCIEDADE PADRÃO DE EDUCAÇÃO SUPERIOR LTDA. - FACULDADE PITÁGORAS DE MONTES CLAROS;MINAS GERAIS;NÃO;ATIVA;PRIVADA COM FINS LUCRATIVOS;2025-10-23
2716;INSTITUTO DE OBSERVAÇÃO DA TERRA;MINAS GERAIS;NÃO;INATIVA;PRIVADA SEM FINS LUCRATIVOS;2025-10-23
2717;PLUS CONSULTORIA E ASSESSORIA LTDA;MINAS GERAIS;NÃO;INATIVA;OUTROS;2025-10-23
2718;TEKNISA SOFTWARE LTDA;MINAS GERAIS;NÃO;INATIVA;PRIVADA COM FINS LUCRATIVOS;2025-10-23
2719;GRUPO IBMEC EDUCACIONAL S.A.;MINAS GERAIS;NÃO;INATIVA;PRIVADA COM FINS LUCRATIVOS;2025-10-23
2720;ASSOCIAÇÃO EDUCACIONAL DE PATOS DE MINAS/ FACULDADE DE PATOS DE MINAS;MINAS GERAIS;NÃO;INATIVA;PRIVADA SEM FINS LUCRATIVOS;2025-10-23
2721;CZM INDUSTRIA DE EQUIPAMENTOS LTDA;MINAS GERAIS;NÃO;INATIVA;PRIVADA COM FINS LUCRATIVOS;2025-10-23
2722;INTERATIVA 3D LTDA;MINAS GERAIS;NÃO;INATIVA;PRIVADA COM FINS LUCRATIVOS;2025-10-23
2723;SISTEMA DE INFORMAÇÃO DO INVESTIDOR LTDA;MINAS GERAIS;NÃO;INATIVA;PRIVADA COM FINS LUCRATIVOS;2025-10-23
2724;CENTRO DE COMUNICAÇÃO, DESIGN E TECNOLOGIA GRÁFICA;MINAS GERAIS;NÃO;INATIVA;PRIVADA SEM FINS LUCRATIVOS;2025-10-23
2725;JIVA GESTÃO DE NEGÓCIOS LTDA;MINAS GERAIS;NÃO;INATIVA;PRIVADA COM FINS LUCRATIVOS;2025-10-23
2726;ASSOCIAÇÃO MANTENEDORA DO MUSEU DAS MINAS E DO METAL/MUSEU;MINAS GERAIS;NÃO;ATIVA;PRIVADA SEM FINS LUCRATIVOS;2025-10-23
2727;FUNDAÇÃO DE APOIO AO DESENVOLVIMENTO EMPRESARIAL;MINAS GERAIS;NÃO;INATIVA;PRIVADA SEM FINS LUCRATIVOS;2025-10-23
2728;SERVIÇO NACIONAL DE APRENDIZAGEM COMERCIAL/FACULDADE SENAC MINAS;MINAS GERAIS;NÃO;INATIVA;PRIVADA SEM FINS LUCRATIVOS;2025-10-23
2729;JUNTA DE EDUCAÇÃO DA CONVENÇÃO BATISTA MINEIRA/FACULDADE BATISTA MINAS GERAIS;MINAS GERAIS;NÃO;INATIVA;PRIVADA SEM FINS LUCRATIVOS;2025-10-23
2730;INSTITUTO NACIONAL DE GESTÃO E ESTUDOS SOCIAIS;MINAS GERAIS;NÃO;INATIVA;PRIVADA SEM FINS LUCRATIVOS;2025-10-23
2731;INSTITUTO EDUCACIONAL SANTO AGOSTINHO LTDA/ FACULDADE SANTO AGOSTINHO;MINAS GERAIS;NÃO;INATIVA;PRIVADA COM FINS LUCRATIVOS;2025-10-23
2732;ASSOCIAÇÃO NACIONAL DE EMPRESAS DE BIOTECNOLOGIA E CIÊNCIAS DA VIDA;MINAS GERAIS;NÃO;ATIVA;PRIVADA SEM FINS LUCRATIVOS;2025-10-23
2733;ITECHNOLOGIES LTDA;MINAS GERAIS;NÃO;INATIVA;PRIVADA COM FINS LUCRATIVOS;2025-10-23
2734;SOCIEDADE EDUCACIONAL GARDINGO LTDA./FACULDADE VÉRTICE;MINAS GERAIS;NÃO;INATIVA;PRIVADA COM FINS LUCRATIVOS;2025-10-23
2735;EDITORA E DISTRIBUIDORA EDUCACIONAL S/A;MINAS GERAIS;NÃO;INATIVA;PRIVADA COM FINS LUCRATIVOS;2025-10-23
2736;PONTE ENTRE CULTURAS MINAS GERAIS;MINAS GERAIS;NÃO;INATIVA;PRIVADA SEM FINS LUCRATIVOS;2025-10-23
2737;FUNDAÇÃO EDUCACIONAL NORDESTE MINEIRO;MINAS GERAIS;NÃO;INATIVA;PRIVADA SEM FINS LUCRATIVOS;2025-10-23
2739;POLICIA MILITAR DO ESTADO DE MINAS GERAIS;MINAS GERAIS;SIM;ATIVA;PÚBLICA ESTADUAL;2025-10-23
2740;INSTITUTO PAGUS ECOLOGIA CULTURA E CIDADANIA;MINAS GERAIS;NÃO;INATIVA;PRIVADA SEM FINS LUCRATIVOS;2025-10-23
2741;ANALAG CONSULTORIA E SERVIÇOS LTDA;MINAS GERAIS;NÃO;INATIVA;PRIVADA COM FINS LUCRATIVOS;2025-10-23
2742;ASSOCIAÇÃO EDUCACIONAL DR. ODILON FERNANDES/ FACULDADES DE CIÊNCIAS ECONÔMICAS DO TRIÂNGULO MINEIRO;MINAS GERAIS;NÃO;INATIVA;PRIVADA SEM FINS LUCRATIVOS;2025-10-23
2743;INSTITUTO DE VIDA E SAÚDE;MINAS GERAIS;NÃO;INATIVA;PRIVADA SEM FINS LUCRATIVOS;2025-10-23
2744;CENTRO DE ESTUDOS III MILLENIUM LTDA;MINAS GERAIS;NÃO;INATIVA;PRIVADA SEM FINS LUCRATIVOS;2025-10-23
2745;MAGNETICOCO EMPREENDIMENTOS TECNOLÓGICOS LTDA.;MINAS GERAIS;NÃO;INATIVA;PRIVADA COM FINS LUCRATIVOS;2025-10-23
2746;INSTITUIÇÃO ITURAMENSE DE ENSINO SUPERIOR/FACULDADE ALDETE MARIA ALVES;MINAS GERAIS;NÃO;INATIVA;PRIVADA SEM FINS LUCRATIVOS;2025-10-23
2747;INSTITUTO VIDA E SAÚDE;MINAS GERAIS;NÃO;INATIVA;PRIVADA SEM FINS LUCRATIVOS;2025-10-23
2748;FUNDAÇÃO VALE DO GORUTUBA DE NOVA PORTEIRINHA;MINAS GERAIS;NÃO;INATIVA;PRIVADA SEM FINS LUCRATIVOS;2025-10-23
2749;MINASTEC - DESIGN HOUSE DE TECNOLOGIA DE PROJETOS DE CIRCUITOS INTEGRADOS;MINAS GERAIS;NÃO;INATIVA;PRIVADA SEM FINS LUCRATIVOS;2025-10-23
2750;ASSOCIAÇÃO MINEIRA DE BUBALINOCULTORES;MINAS GERAIS;NÃO;INATIVA;PRIVADA SEM FINS LUCRATIVOS;2025-10-23
2751;FUNDAÇÃO CPQD - CENTRO DE PESQUISA E DESENVOLVIMENTO EM TELECOMUNICAÇÕES;SÃO PAULO;NÃO;INATIVA;PRIVADA SEM FINS LUCRATIVOS;2025-10-23
2752;IN3 INTELIGÊNCIA DE MERCADO LTDA;MINAS GERAIS;NÃO;INATIVA;PRIVADA COM FINS LUCRATIVOS;2025-10-23
2753;INSTITUTO DE TECNOLOGIA PARA O DESENVOLVIMENTO;PARANÁ;NÃO;INATIVA;PRIVADA SEM FINS LUCRATIVOS;2025-10-23
2754;ASOTECH - ADVANCED SYSTEM OPTIMIZATION TECNOLOGIS LTDA.;MINAS GERAIS;NÃO;INATIVA;PRIVADA COM FINS LUCRATIVOS;2025-10-23
2755;FUNDAÇÃO PARA O DESENVOLVIMENTO DE BAURU;SÃO PAULO;NÃO;INATIVA;PRIVADA SEM FINS LUCRATIVOS;2025-10-23
2756;CENERGEL CONSULTORIA EM SISTEMAS ENERGÉTICOS LTDA.;MINAS GERAIS;NÃO;INATIVA;PRIVADA COM FINS LUCRATIVOS;2025-10-23
2757;ÁGORA COMUNICAÇÃO E CULTURA LTDA.;MINAS GERAIS;NÃO;INATIVA;PRIVADA COM FINS LUCRATIVOS;2025-10-23
2758;CENTRO DE DESENVOLVIMENTO TECNOLÓGICO E SOCIAL DO VALE DA ELETRÔNICA STEFAN BOGDAN SALEJ;MINAS GERAIS;NÃO;INATIVA;PRIVADA SEM FINS LUCRATIVOS;2025-10-23
2759;FUNDAÇÃO CENTROS DE REFERÊNCIA EM TECNOLOGIAS INOVADORAS;SANTA CATARINA;NÃO;INATIVA;PRIVADA SEM FINS LUCRATIVOS;2025-10-23
2760;HIGH-Z VALE INDÚSTRIA ELETRÔNICA LTDA - ME;MINAS GERAIS;NÃO;INATIVA;PRIVADA COM FINS LUCRATIVOS;2025-10-23
2761;AXXIOM SOLUÇÕES TECNOLÓGICAS S.A.;MINAS GERAIS;NÃO;ATIVA;PRIVADA COM FINS LUCRATIVOS;2025-10-23
2762;NAUTILUS ENGENHARIA LTDA.;MINAS GERAIS;NÃO;INATIVA;PRIVADA COM FINS LUCRATIVOS;2025-10-23
2763;TECSULVALE INDÚSTRIA E COMÉRCIO DE EQUIPAMENTOS;MINAS GERAIS;NÃO;INATIVA;PRIVADA COM FINS LUCRATIVOS;2025-10-23
2764;SENIOR EQUIPAMENTOS LTDA.;MINAS GERAIS;NÃO;INATIVA;PRIVADA COM FINS LUCRATIVOS;2025-10-23
2765;TECNOMETAL ENGENHARIA E CONSTRUÇÕES MECÂNICAS LTDA.;MINAS GERAIS;NÃO;INATIVA;PRIVADA COM FINS LUCRATIVOS;2025-10-23
2766;SINAPSIS INOVAÇÃO EM ENERGIA S/S LTDA.;SÃO PAULO;NÃO;INATIVA;PRIVADA COM FINS LUCRATIVOS;2025-10-23
2767;VISUAL VIRTUAL COMPUTAÇÃO GRÁFICA LTDA. ME.;MINAS GERAIS;NÃO;INATIVA;PRIVADA COM FINS LUCRATIVOS;2025-10-23
2768;QUANTUM DO BRASIL LTDA.;MINAS GERAIS;NÃO;ATIVA;PRIVADA COM FINS LUCRATIVOS;2025-10-23
2769;ECO BUSINESS SOLUTIONS, CONSULTORIA EMPRESARIAL, AMBIENTAL, MARKETING E NEGÓCIOS INTERNACIONAIS LTDA;MINAS GERAIS;NÃO;INATIVA;PRIVADA COM FINS LUCRATIVOS;2025-10-23
2770;SISTEMA METEOROLÓGICO DO PARANÁ;PARANÁ;NÃO;INATIVA;PRIVADA SEM FINS LUCRATIVOS;2025-10-23
2771;GÁS ENERGY TECNOLOGIA LTDA.;RIO DE JANEIRO;NÃO;INATIVA;PRIVADA COM FINS LUCRATIVOS;2025-10-23
2772;ONDATEC TECNOLOGIA INDUSTRIAL EM MICROONDAS LTDA.;MINAS GERAIS;NÃO;INATIVA;PRIVADA COM FINS LUCRATIVOS;2025-10-23
2773;BETAPYX TECNOLOGIA EM DECISÃO LTDA - ME;MINAS GERAIS;NÃO;INATIVA;PRIVADA COM FINS LUCRATIVOS;2025-10-23
2774;CURUPIRA S.A.;MINAS GERAIS;NÃO;INATIVA;PRIVADA COM FINS LUCRATIVOS;2025-10-23
2775;FUNDAÇÃO PARA O DESENVOLVIMENTO TECNOLÓGICO DA ENGENHARIA;SÃO PAULO;NÃO;INATIVA;PRIVADA SEM FINS LUCRATIVOS;2025-10-23
2776;D & V CONSULTORIA E INFORMÁTICA LTDA.;MINAS GERAIS;NÃO;INATIVA;PRIVADA COM FINS LUCRATIVOS;2025-10-23
2777;PONTIFÍCIA UNIVERSIDADE CATÓLICA DO RIO DE JANEIRO;RIO DE JANEIRO;SIM;INATIVA;PRIVADA SEM FINS LUCRATIVOS;2025-10-23
2778;LOOP OTIMIZAÇÃO DE PROCESSOS LTDA.;MINAS GERAIS;NÃO;INATIVA;PRIVADA COM FINS LUCRATIVOS;2025-10-23
2779;INSTITUTO DE CULTURA E HUMANIDADES;MINAS GERAIS;NÃO;INATIVA;PRIVADA SEM FINS LUCRATIVOS;2025-10-23
2780;GEOGAMA - PROCESSOS TECNOLÓGICOS AVANÇADOS, CONSULTORIA E ENGENHARIA LTDA.- ME.;MINAS GERAIS;NÃO;INATIVA;PRIVADA COM FINS LUCRATIVOS;2025-10-23
2781;P3ID - PESQUISA, PLANEJAMENTO, PROJETOS , INOVAÇÃO E DESENVOLVIMENTO TECNOLÓGICO LTDA.;RIO DE JANEIRO;NÃO;INATIVA;PRIVADA COM FINS LUCRATIVOS;2025-10-23
2782;IX ESTUDOS E PROJETOS LTDA.;MINAS GERAIS;NÃO;INATIVA;PRIVADA COM FINS LUCRATIVOS;2025-10-23
2783;HIDROSEV CONSULTORIA E SERVIÇO LTDA.;SÃO PAULO;NÃO;INATIVA;PRIVADA COM FINS LUCRATIVOS;2025-10-23
2784;CISER NEDSCHROEF FIXADORES AUTOMOTIVOS S/A;MINAS GERAIS;NÃO;INATIVA;PRIVADA COM FINS LUCRATIVOS;2025-10-23
2785;CHEMTECH SERVIÇOS DE ENGENHARIA E SOFTWARE LTDA.;MINAS GERAIS;NÃO;INATIVA;PRIVADA COM FINS LUCRATIVOS;2025-10-23
2786;TSA - TECNOLOGIA DE SISTEMAS DE AUTOMAÇÃO S/A.;MINAS GERAIS;NÃO;INATIVA;PRIVADA COM FINS LUCRATIVOS;2025-10-23
2787;T-SYSTEMS DO BRASIL LTDA.;SÃO PAULO;NÃO;INATIVA;PRIVADA COM FINS LUCRATIVOS;2025-10-23
2788;VENIDERA PESQUISA E DESENVOLVIMENTO DE SISTEMAS DE INFORMAÇÃO LTDA.;SÃO PAULO;NÃO;INATIVA;PRIVADA COM FINS LUCRATIVOS;2025-10-23
2789;TECNOMÉTRICA ESTATÍSTICA LTDA.;SÃO PAULO;NÃO;INATIVA;PRIVADA COM FINS LUCRATIVOS;2025-10-23
2790;GCT GLOBAL CIÊNCIA & TECNOLOGIA  BIO S/A.;MINAS GERAIS;NÃO;INATIVA;PRIVADA COM FINS LUCRATIVOS;2025-10-23
2791;NSB TECNOLOGIA E SEGURANÇA DA INFORMAÇÃO LTDA.;SÃO PAULO;NÃO;INATIVA;PRIVADA COM FINS LUCRATIVOS;2025-10-23
2792;ESCHER CONSULTORIA E ENGENHARIA LTDA.;MINAS GERAIS;NÃO;INATIVA;PRIVADA COM FINS LUCRATIVOS;2025-10-23
2793;EQUIPE B ARQUITETURA, DESIGN E MULTIMÍDIAS LTDA.;MINAS GERAIS;NÃO;INATIVA;PRIVADA COM FINS LUCRATIVOS;2025-10-23
2794;EXPERTI EMPREENDIMENTOS LTDA.;MINAS GERAIS;NÃO;INATIVA;PRIVADA COM FINS LUCRATIVOS;2025-10-23
2795;WAYCARBON SOLUÇÕES AMBIENTAIS E PROJETOS DE CARBONO LTDA.;MINAS GERAIS;NÃO;INATIVA;PRIVADA COM FINS LUCRATIVOS;2025-10-23
2796;FUNDAÇÃO DE PESQUISA E ASSESSORAMENTO À INDÚSTRIA;MINAS GERAIS;SIM;ATIVA;PRIVADA SEM FINS LUCRATIVOS;2025-10-23
2797;COLÉGIO NOSSA SENHORA DAS GRAÇAS LTDA;MINAS GERAIS;NÃO;INATIVA;PRIVADA COM FINS LUCRATIVOS;2025-10-23
2798;KEYMAX INDÚSTRIA  E COMÉRCIO LTDA - ME;MINAS GERAIS;NÃO;INATIVA;PRIVADA COM FINS LUCRATIVOS;2025-10-23
2799;MEIUS ENGENHARIA  LTDA. ME;MINAS GERAIS;NÃO;INATIVA;PRIVADA COM FINS LUCRATIVOS;2025-10-23
2800;ORTENG ENERGIA LTDA.;MINAS GERAIS;NÃO;INATIVA;PRIVADA COM FINS LUCRATIVOS;2025-10-23
2801;PROATIVA SOFTWARE LTDA;MINAS GERAIS;NÃO;INATIVA;PRIVADA COM FINS LUCRATIVOS;2025-10-23
2802;INSTITUTO DE TECNOLOGIA APLICADA E INOVAÇÃO;PARANÁ;NÃO;INATIVA;PRIVADA SEM FINS LUCRATIVOS;2025-10-23
2803;ARCELOR MITTAL BIOFLORESTAS;MINAS GERAIS;NÃO;INATIVA;PRIVADA COM FINS LUCRATIVOS;2025-10-23
2804;HITACHI BRASIL LTDA;SÃO PAULO;NÃO;INATIVA;PRIVADA COM FINS LUCRATIVOS;2025-10-23
2805;CONEXÃO ENERGIA LTDA;MINAS GERAIS;NÃO;INATIVA;PRIVADA COM FINS LUCRATIVOS;2025-10-23
2806;QUALITY ADMINISTRADORA DE PATRIMÔNIOS E INVESTIMENTOS LTDA;MINAS GERAIS;NÃO;INATIVA;PRIVADA COM FINS LUCRATIVOS;2025-10-23
2807;FCA FIAT CHRYSLER AUTOMÓVEIS BRASIL LTDA.;MINAS GERAIS;NÃO;INATIVA;PRIVADA COM FINS LUCRATIVOS;2025-10-23
2808;CENTRO DE FORMAÇÃO PROFISSIONAL AFONSO GRECO;MINAS GERAIS;NÃO;INATIVA;PRIVADA SEM FINS LUCRATIVOS;2025-10-23
2809;J. M. M. AGRO TECHONOLOGIC INDUSTRIA E COMÉRCIO DE SOFTWARE E EQUIPAMENTOS ELETRO ELETRÔNICOS  LTDA;MINAS GERAIS;NÃO;INATIVA;PRIVADA COM FINS LUCRATIVOS;2025-10-23
2810;DATACONSUMER  - CENTRO DE PESQUISA AVANÇADA LTDA.;MINAS GERAIS;NÃO;INATIVA;PRIVADA COM FINS LUCRATIVOS;2025-10-23
2811;ATIVA SOLUÇÕES TECNOLÓGICAS INDÚSTRIA E COMÉRCIO LTDA;MINAS GERAIS;NÃO;INATIVA;PRIVADA COM FINS LUCRATIVOS;2025-10-23
2812;SERVIÇO NACIONAL DE APRENDIZAGEM INDUSTRIAL - SENAI (CAMPUS CETEC);MINAS GERAIS;SIM;ATIVA;PRIVADA SEM FINS LUCRATIVOS;2025-10-23
2813;EUDORA ENERGIA LTDA;SÃO PAULO;NÃO;INATIVA;PRIVADA COM FINS LUCRATIVOS;2025-10-23
2814;BALTEAU PRODUTOS ELÉTRICOS LTDA.;MINAS GERAIS;NÃO;INATIVA;PRIVADA COM FINS LUCRATIVOS;2025-10-23
2815;EWL ASSESSORIA TÉCNICA LTDA;SÃO PAULO;NÃO;INATIVA;PRIVADA COM FINS LUCRATIVOS;2025-10-23
2816;BARCELLOS & CÂMARA LTDA.;MINAS GERAIS;NÃO;INATIVA;PRIVADA COM FINS LUCRATIVOS;2025-10-23
2817;CORE NETWORKS LTDA.;MINAS GERAIS;NÃO;INATIVA;PRIVADA COM FINS LUCRATIVOS;2025-10-23
2818;MATRIX ENGENHARIA EM ENERGIA LTDA.;SÃO PAULO;NÃO;INATIVA;PRIVADA COM FINS LUCRATIVOS;2025-10-23
2819;PITANGUI AGRO FLORESTAL LTDA.;MINAS GERAIS;NÃO;INATIVA;PRIVADA COM FINS LUCRATIVOS;2025-10-23
2820;COMPANHIA SIDERÚRGICA PITANGUI;MINAS GERAIS;NÃO;INATIVA;PRIVADA COM FINS LUCRATIVOS;2025-10-23
2821;INCLUIR TECNOLOGIA LTDA - ME;MINAS GERAIS;NÃO;INATIVA;PRIVADA COM FINS LUCRATIVOS;2025-10-23
2822;DAIMON ENGENHARIA E SISTEMAS S/S LTDA.;SÃO PAULO;NÃO;INATIVA;PRIVADA COM FINS LUCRATIVOS;2025-10-23
2823;SIEMENS LTDA.;SÃO PAULO;NÃO;INATIVA;PRIVADA COM FINS LUCRATIVOS;2025-10-23
2824;RJCHEM CONSULTORIA EM PROJETO DE PESQUISA;RIO DE JANEIRO;NÃO;INATIVA;PRIVADA COM FINS LUCRATIVOS;2025-10-23
2825;PFO SOLUÇÕES INTELIGENTES LTDA.;MINAS GERAIS;NÃO;INATIVA;PRIVADA COM FINS LUCRATIVOS;2025-10-23
2826;BRAFER CONSTRUÇÕES METÁLICAS;PARANÁ;NÃO;INATIVA;PRIVADA COM FINS LUCRATIVOS;2025-10-23
2827;GPTECH - GESTÃO E PESQUISAS TECNOLÓGICAS;SÃO PAULO;NÃO;INATIVA;PRIVADA COM FINS LUCRATIVOS;2025-10-23
2828;ALSTOM GRID ENERGIA LTDA.;MINAS GERAIS;NÃO;INATIVA;PRIVADA COM FINS LUCRATIVOS;2025-10-23
2829;NASTEK INDÚSTRIA E TECNOLOGIA LTDA.;MATO GROSSO DO SUL;NÃO;INATIVA;PRIVADA COM FINS LUCRATIVOS;2025-10-23
2830;FUNDAÇÃO DE APOIO À UNIVERSIDADE DE SÃO PAULO;SÃO PAULO;NÃO;INATIVA;PRIVADA SEM FINS LUCRATIVOS;2025-10-23
2831;ECOLOGY AND ENVIRONMENT DO BRASIL LTDA.;RIO DE JANEIRO;NÃO;INATIVA;PRIVADA COM FINS LUCRATIVOS;2025-10-23
2832;TEC HIDRO ENGENHARIA  S/S LTDA;SÃO PAULO;NÃO;INATIVA;PRIVADA COM FINS LUCRATIVOS;2025-10-23
2833;CENTRO DE PESQUISA E INOVAÇÃO SUECO - BRASILEIRO;SÃO PAULO;NÃO;INATIVA;PRIVADA SEM FINS LUCRATIVOS;2025-10-23
2834;DNMCA - CONSULTORIA E DESENVOLVIMENTO DE NEGÓCIOS LTDA.;RIO DE JANEIRO;NÃO;INATIVA;PRIVADA COM FINS LUCRATIVOS;2025-10-23
2835;IN FORMA SOFTWARE LTDA.;PERNAMBUCO;NÃO;INATIVA;PRIVADA COM FINS LUCRATIVOS;2025-10-23
2836;FUNDAÇÃO BIO RIO;RIO DE JANEIRO;NÃO;INATIVA;PRIVADA SEM FINS LUCRATIVOS;2025-10-23
2837;TEC HIDRO ENGENHARIA S/S LTDA.;SÃO PAULO;NÃO;INATIVA;OUTROS;2025-10-23
2838;KNBS TELECOMUNICAÇÕES E INFORMÁTICA LTDA;SÃO PAULO;NÃO;INATIVA;PRIVADA COM FINS LUCRATIVOS;2025-10-23
2839;MG INFO INFORMÁTICA LTDA - ME;MINAS GERAIS;NÃO;INATIVA;PRIVADA COM FINS LUCRATIVOS;2025-10-23
2840;INFINITY TECHNOLOGY INDÚSTRIA E COMÉRCIO DE ELETRÔNICOS LTDA;MINAS GERAIS;NÃO;INATIVA;PRIVADA COM FINS LUCRATIVOS;2025-10-23
2841;PRB CONSULTORIA E PROJETOS AMBIENTAIS LTDA - EPP;MINAS GERAIS;NÃO;INATIVA;PRIVADA COM FINS LUCRATIVOS;2025-10-23
2842;SOLARIA BRASIL LTDA;SÃO PAULO;NÃO;INATIVA;PRIVADA COM FINS LUCRATIVOS;2025-10-23
